Name,Description,Latitude,Longitude,InfoURL,ImgURL
UCSB,A great university located along the California coast!,34.416929,-119.845991,https://en.wikipedia.org/wiki/University_of_California,https://www.history.ucsb.edu/wp-content/uploads/LagoonFall20141.jpg
Loma Linda University Hospital ,An excellent hospital that saved my life when I went into cardiac arrest.,34.0515,-117.2585,https://lluh.org/,https://www.riversidetransit.com/images/ARTICLE_ART/DESTINATIONS/2019/LOMA-LINDA-UNIVERSITY-MEDICAL-CENTER.jpg
Redlands High School,An adequate high school that left me with many fond memories.,34.0551,-117.1709,https://www.redlandsusd.net/rhs,https://upload.wikimedia.org/wikipedia/commons/6/66/Redlands_High_School.jpg
Popeyes Louisiana Kitchen,"My favorite fast food place, and the spot that my friends and I would spend time after school.",34.0634,-117.2823,https://www.popeyes.com/explore-menu,https://images.barrons.com/im-101291?width=620&size=1.5
UPS Store,My current job; I'm lucky to work with amazing coworkers every day.,34.049444,-117.204722,https://locations.theupsstore.com/ca/redlands/1508-barton-rd,https://dynl.mktgcdn.com/p/gBxx9HCVjzLsmEKdK8QJo4IGyTdyQAQ9FAFmlckV6ho/600x450.jpg
Fremont Street,"A Very fun place in Las Vegas, of which I have fond memories",36.1558,-115.1178,https://vegasexperience.com/,https://media.tacdn.com/media/attractions-splice-spp-674x446/0b/27/57/8e.jpg
"Lima, Ohio","This is my birthplace; a dreary, depressing town.",40.7426,84.1052,https://www.cityhall.lima.oh.us/,https://upload.wikimedia.org/wikipedia/commons/6/69/Lima-ohio-downtown2.jpg